{
  "id": "APP-PM1-INTRO-P5-PG-002",
  "item": "PM1:INTRODUCTION-CH1-PP4-10",
  "locus": {"volume": 1, "printed_page": 5, "scan_leaf": 27, "line_or_formula": "list of small Greek letters assigned constant meanings"},
  "classification": "digital-witness-error",
  "diplomatic_reading": "ε, ι, π and (at a later stage) to η, θ and ω",
  "other_reading": "ε, ι and (at a later stage) to η, θ and ω",
  "witnesses": [
    {"siglum": "PM1-1910-SCAN", "reading": "ε, ι, π and (at a later stage) to η, θ and ω", "uri": "https://en.wikisource.org/wiki/Page:Russell,_Whitehead_-_Principia_Mathematica,_vol._I,_1910.djvu/27"},
    {"siglum": "PG78050", "reading": "ε, ι and (at a later stage) to η, θ and ω", "uri": "https://www.gutenberg.org/files/78050/78050-src/78050-src.htm"},
    {"siglum": "WS-PM1", "reading": "ε, ι, π and (at a later stage) to η, θ and ω", "uri": "https://en.wikisource.org/w/index.php?title=Page:Russell,_Whitehead_-_Principia_Mathematica,_vol._I,_1910.djvu/27&action=raw"}
  ],
  "evidence": "The scan visibly includes π between ι and and; Wikisource agrees. PG78050 alone omits it. This is not a sic in PM.",
  "status": "single-checked",
  "review": {"editor": "Codex source audit", "date": "2026-08-10"}
}
