{
  "id": "APP-PM1-INTRO-P56-PG-PARENTHESIS-001",
  "item": "PM1:INTRODUCTION-CH2-HIGHER-ORDER-PREDICATIVE-PP55-56",
  "locus": {
    "volume": 1,
    "printed_page": 56,
    "scan_leaf": 78,
    "line_or_formula": "quantified predicative-function expression"
  },
  "classification": "digital-witness-error",
  "diplomatic_reading": "(φ, ψ).f!(φ!ẑ, ψ!ẑ, x)",
  "other_reading": "(φ, ψ).f!(φ!ẑ, ψ!ẑ, x))",
  "witnesses": [
    {
      "siglum": "SCAN",
      "reading": "(φ, ψ).f!(φ!ẑ, ψ!ẑ, x)",
      "uri": "https://en.wikisource.org/wiki/Page:Russell,_Whitehead_-_Principia_Mathematica,_vol._I,_1910.djvu/78"
    },
    {
      "siglum": "PG78050",
      "reading": "(φ, ψ).f!(φ!ẑ, ψ!ẑ, x))",
      "uri": "https://www.gutenberg.org/files/78050/78050-src/78050-src.htm"
    },
    {
      "siglum": "WS-PM1",
      "reading": "(φ, ψ).f!(φ!ẑ, ψ!ẑ, x)",
      "uri": "https://en.wikisource.org/w/index.php?title=Page:Russell,_Whitehead_-_Principia_Mathematica,_vol._I,_1910.djvu/78&action=raw"
    }
  ],
  "evidence": "PG adds a closing parenthesis absent from the scan and Wikisource.",
  "status": "double-checked",
  "review": {
    "editor": "Codex source audit",
    "date": "2026-08-10",
    "second_reviewer": "scan/two-digital-witness cross-check"
  }
}

