{
  "id": "APP-PM1-INTRO-P54-PG-VALUE-HAT-001",
  "item": "PM1:INTRODUCTION-CH2-MATRICES-FIRST-ORDER-PP53-54",
  "locus": {
    "volume": 1,
    "printed_page": 54,
    "scan_leaf": 76,
    "line_or_formula": "notation for a value of a first-order function"
  },
  "classification": "digital-witness-error",
  "diplomatic_reading": "φ!x",
  "other_reading": "φ!x̂",
  "witnesses": [
    {
      "siglum": "SCAN",
      "reading": "φ!x",
      "uri": "https://en.wikisource.org/wiki/Page:Russell,_Whitehead_-_Principia_Mathematica,_vol._I,_1910.djvu/76"
    },
    {
      "siglum": "PG78050",
      "reading": "φ!x̂",
      "uri": "https://www.gutenberg.org/files/78050/78050-src/78050-src.htm"
    },
    {
      "siglum": "WS-PM1",
      "reading": "φ!x",
      "uri": "https://en.wikisource.org/w/index.php?title=Page:Russell,_Whitehead_-_Principia_Mathematica,_vol._I,_1910.djvu/76&action=raw"
    }
  ],
  "evidence": "PG incorrectly repeats the function hat in the notation for a value; scan and Wikisource distinguish φ!x̂ from φ!x.",
  "status": "double-checked",
  "review": {
    "editor": "Codex source audit",
    "date": "2026-08-10",
    "second_reviewer": "scan/two-digital-witness cross-check"
  }
}

