{
  "id": "APP-PM1-INTRO-P87-WS-HE-002",
  "item": "PM1:INTRODUCTION-CH3-INCOMPLETE-SYMBOLS-SUMMARY-PP86B-88",
  "locus": {
    "volume": 1,
    "printed_page": 87,
    "scan_leaf": 109,
    "line_or_formula": "class incompleteness paragraph"
  },
  "classification": "digital-witness-error",
  "marker": "corr.",
  "diplomatic_reading": "It may be illustrated",
  "other_reading": "Wikisource has “It may he illustrated”",
  "witnesses": [
    {
      "siglum": "PM1-1910-SCAN",
      "reading": "may be illustrated",
      "uri": "https://en.wikisource.org/wiki/Page:Russell,_Whitehead_-_Principia_Mathematica,_vol._I,_1910.djvu/109"
    },
    {
      "siglum": "WS-PM1",
      "reading": "may he illustrated",
      "uri": "https://en.wikisource.org/w/index.php?title=Page:Russell,_Whitehead_-_Principia_Mathematica,_vol._I,_1910.djvu/109&action=raw"
    }
  ],
  "evidence": "The scan clearly prints “be”; Wikisource misreads b as h.",
  "status": "double-checked",
  "review": {
    "editor": "Codex source audit",
    "date": "2026-08-10",
    "second_reviewer": "scan/PG control"
  }
}
